<?xml version="1.0" encoding="UTF-8"?>
<xs:schema xmlns:xs="http://www.w3.org/2001/XMLSchema">
  <xs:element name="users">
    <xs:complexType>
      <xs:sequence>
        <xs:element name="user" minOccurs="0" maxOccurs="unbounded">
          <xs:complexType>
            <xs:sequence>
              <xs:element name="name">
                <xs:complexType>
                  <xs:sequence>
                    <xs:element name="first" type="xs:string"/>
                    <xs:element name="last" type="xs:string"/>
                  </xs:sequence>
                </xs:complexType>
              </xs:element>
              <xs:element name="email" type="email"/>
              <xs:element name="dateJoined" type="xs:date"/>
              <xs:element name="username" type="xs:string"/>
              <xs:element name="password" type="xs:string"/>
              <xs:element name="location">
                <xs:complexType>
                  <xs:sequence>
                    <xs:element name="country" type="xs:string"/>
                    <xs:element name="timezone" type="timezone"/>
                  </xs:sequence>
                </xs:complexType>
              </xs:element>
            </xs:sequence>
            <xs:attribute name="role" type="role" use="required"/>
            <xs:attribute name="id" type="xs:integer" use="required"/>
          </xs:complexType>
        </xs:element>
      </xs:sequence>
    </xs:complexType>
  </xs:element>
  <xs:simpleType name="role">
    <xs:restriction base="xs:string">
      <xs:enumeration value="client"/>
      <xs:enumeration value="support"/>
    </xs:restriction>
  </xs:simpleType>
  <xs:simpleType name="email">
    <xs:restriction base="xs:string">
      <xs:pattern value="[a-zA-z0-9]{2,20}@[a-zA-z0-9]{2,20}.[a-zA-z]{2,20}"/>
    </xs:restriction>
  </xs:simpleType>
  <xs:simpleType name="status">
    <xs:restriction base="xs:string">
      <xs:enumeration value="open"/>
      <xs:enumeration value="resolved"/>
    </xs:restriction>
  </xs:simpleType>
  <xs:simpleType name="timezone">
    <xs:restriction base="xs:string">
      <xs:pattern value="[a-zA-z0-9]{3}"/>
    </xs:restriction>
  </xs:simpleType>
</xs:schema>
